OTROS TRASTORNOS DE LOS DIENTES Y DE SUS ESTRUCTURAS DE SOSTÉN,
Atrofia del reborde alveolar desdentado,
Exfoliación de los dientes debida a causas sistémicas,
Otras afecciones especificadas de los dientes y de sus estructuras de sostén,Agrandamiento del reborde alveolar. Odontalgia. Prolongación alveolar irregular.
"Pérdida de dientes debida a accidente, extracción o enfermedad periodontal local",
Raíz dental retenida,
"Trastornos de los dientes y de sus estructuras de sostén, no especificado",
